{"schema":"nrm.customer.resource_demand_response.v1","messageId":"demand-001","timestamp":"2026-08-17T10:00:01+08:00","source":"NRM","data":{"demandSetId":"mission-demands","revision":1,"snapshotVersion":110,"totalCount":2,"satisfiedCount":1,"unsatisfiedCount":1,"dataInvalidCount":0,"results":[{"demandId":"video-01","status":"UNSATISFIED","reasonCodes":["BANDWIDTH_NOT_MET"],"recommendations":[{"type":"ROUTE","status":"AVAILABLE","value":"survey_uav_1->airborne_relay->data_processing_center","reason":"NONE"}]},{"demandId":"command-01","status":"SATISFIED","reasonCodes":[],"recommendations":[]}]}}
